{
  "schema_version": "0.1",
  "record_type": "run",
  "run_id": "synthetic-dataset-v0-1-run-aborted-001",
  "status": "aborted",
  "equipment": {
    "equipment_class": "synthetic_demo_equipment",
    "public_label": "demo-unit-aborted"
  },
  "module": {
    "module_class": "synthetic_process_module",
    "public_label": "demo-module-aborted"
  },
  "process_type": "synthetic_abort_demo",
  "timestamps": {
    "start": "2026-02-03T12:00:00Z",
    "end": "2026-02-03T12:03:00Z",
    "time_status": "known"
  },
  "parameters": [
    {
      "parameter_id": "synthetic-aborted-duration-001",
      "name": "demo_cycle_duration",
      "parameter_kind": "target",
      "value": 20.0,
      "raw_value": "20.0",
      "value_type": "number",
      "value_status": "known",
      "unit": "s",
      "unit_status": "known",
      "provenance": {
        "source_kind": "synthetic",
        "source_id": "synthetic-semiconductor-engineering-v0.1",
        "locator": "generated:run-aborted-001#parameter-duration",
        "extraction_method": "synthetic_generator"
      }
    }
  ],
  "measurements": [
    {
      "measurement_id": "synthetic-aborted-final-measurement-001",
      "name": "demo_final_signal",
      "measurement_kind": "result",
      "raw_value": "not collected after synthetic abort",
      "value_type": "number",
      "value_status": "not_applicable",
      "unit_status": "not_applicable",
      "provenance": {
        "source_kind": "synthetic",
        "source_id": "synthetic-semiconductor-engineering-v0.1",
        "locator": "generated:run-aborted-001#measurement-final",
        "extraction_method": "synthetic_generator"
      },
      "quality": {
        "quality_status": "incomplete",
        "flags": ["final_value_not_applicable"],
        "notes": ["The fictional final signal was not collected because this demo run was aborted."]
      }
    }
  ],
  "events": [
    {
      "event_id": "synthetic-aborted-start-001",
      "event_type": "state_change",
      "severity": "info",
      "event_status": "observed",
      "code": "SYNTH-START-003",
      "message": "Synthetic abort demo entered the active state.",
      "observed_at": "2026-02-03T12:00:00Z",
      "provenance": {
        "source_kind": "synthetic",
        "source_id": "synthetic-semiconductor-engineering-v0.1",
        "locator": "generated:run-aborted-001#event-start",
        "extraction_method": "synthetic_generator"
      }
    },
    {
      "event_id": "synthetic-aborted-alarm-001",
      "event_type": "alarm",
      "severity": "error",
      "event_status": "unresolved",
      "code": "SYNTH-ABORT-001",
      "message": "Synthetic demo interlock marker requested an abort; this message is not a real safety rule.",
      "observed_at": "2026-02-03T12:03:00Z",
      "provenance": {
        "source_kind": "synthetic",
        "source_id": "synthetic-semiconductor-engineering-v0.1",
        "locator": "generated:run-aborted-001#event-abort",
        "extraction_method": "synthetic_generator"
      },
      "quality": {
        "quality_status": "accepted",
        "flags": ["synthetic_abort_marker"],
        "notes": ["The event code and message are fictional test content."]
      }
    },
    {
      "event_id": "synthetic-aborted-end-001",
      "event_type": "state_change",
      "severity": "info",
      "event_status": "observed",
      "code": "SYNTH-END-003",
      "message": "Synthetic abort demo entered the aborted state.",
      "observed_at": "2026-02-03T12:03:00Z",
      "provenance": {
        "source_kind": "synthetic",
        "source_id": "synthetic-semiconductor-engineering-v0.1",
        "locator": "generated:run-aborted-001#event-end",
        "extraction_method": "synthetic_generator"
      }
    }
  ],
  "metadata": {
    "dataset_id": "synthetic-semiconductor-engineering-v0.1",
    "generator": "hand-authored deterministic synthetic fixture",
    "input_format": "generated",
    "created_at": "2026-02-03T12:05:00Z",
    "labels": ["synthetic", "aborted", "failed_run", "dataset_v0_1"],
    "notes": ["An aborted status is valid schema data; it does not explain a real failure mechanism."]
  },
  "provenance": {
    "source_kind": "synthetic",
    "source_id": "synthetic-semiconductor-engineering-v0.1",
    "locator": "generated:run-aborted-001",
    "extraction_method": "synthetic_generator"
  },
  "quality": {
    "quality_status": "uncertain",
    "flags": ["run_aborted", "final_value_not_applicable"],
    "notes": ["This fixture demonstrates a fictional aborted run with an explicitly not-applicable final measurement."]
  }
}
